{
  "titulo": "Semana do Documento Digital",
  "subtitulo": "Palestras e oficinas gratuitas (evento fictício)",
  "data": "24 a 26 de setembro",
  "horario": "19h",
  "local": "Auditório Exemplo — Santa Maria/RS",
  "destaque": "PDF acessível, assinatura digital e automação",
  "chamada": "Inscreva-se",
  "organizador": "Instituto Fictício",
  "url_qr": "https://exemplo.invalid/inscricao"
}
